No channel specified, using first configured channel: @erics_calls
[90m[2025-11-08 09:07:20][0m [[32mINFO[0m] [HDRBScorer] HDRB scorer initialized with max_ic=1000.0
[90m[2025-11-08 09:07:20][0m [[32mINFO[0m] [CryptoDetector] Crypto detector initialized
[90m[2025-11-08 09:07:20][0m [[32mINFO[0m] [SentimentAnalyzer] Sentiment analyzer initialized
[90m[2025-11-08 09:07:20][0m [[32mINFO[0m] [MessageProcessor] Message processor initialized (confidence_threshold=0.7)
[90m[2025-11-08 09:07:20][0m [[32mINFO[0m] [AddressExtractor] Address extractor initialized (supports EVM chains + Solana)
[90m[2025-11-08 09:07:20][0m [[32mINFO[0m] [PriceEngine] Price engine initialized with 4 APIs (CoinGecko, Birdeye, Moralis, DexScreener)
[90m[2025-11-08 09:07:20][0m [[32mINFO[0m] [HistoricalScraper] Historical scraper initialized
[90m[2025-11-08 09:07:20][0m [[32mINFO[0m] [HistoricalScraper] Connecting to Telegram...
[90m[2025-11-08 09:07:21][0m [[32mINFO[0m] [HistoricalScraper] Fetching 50 messages from @erics_calls...
[90m[2025-11-08 09:07:21][0m [[32mINFO[0m] [HistoricalScraper] Fetched 42 messages
[90m[2025-11-08 09:07:21][0m [[32mINFO[0m] [HistoricalScraper] Processing 42 messages...
[90m[2025-11-08 09:07:21][0m [[32mINFO[0m] [MessageProcessor] Processing message ID: 3644 from channel: Eric Cryptomans Journal
[90m[2025-11-08 09:07:21][0m [[32mINFO[0m] [MessageProcessor] Engagement metrics: forwards=12, reactions=0, replies=0
[90m[2025-11-08 09:07:21][0m [[32mINFO[0m] [HDRBScorer] HDRB score calculated: IC=12.0, normalized=1.20/100
[90m[2025-11-08 09:07:21][0m [[32mINFO[0m] [SentimentAnalyzer] Sentiment analysis: neutral (score: +0.00)
[90m[2025-11-08 09:07:21][0m [[32mINFO[0m] [MessageProcessor] Confidence: LOW (0.10)
[90m[2025-11-08 09:07:21][0m [[32mINFO[0m] [MessageProcessor] Processing completed in 0.46ms
[90m[2025-11-08 09:07:21][0m [[32mINFO[0m] [MessageProcessor] Processing message ID: 3643 from channel: Eric Cryptomans Journal
[90m[2025-11-08 09:07:21][0m [[32mINFO[0m] [MessageProcessor] Engagement metrics: forwards=18, reactions=0, replies=0
[90m[2025-11-08 09:07:21][0m [[32mINFO[0m] [HDRBScorer] HDRB score calculated: IC=18.0, normalized=1.80/100
[90m[2025-11-08 09:07:21][0m [[32mINFO[0m] [SentimentAnalyzer] Sentiment analysis: positive (score: +1.00)
[90m[2025-11-08 09:07:21][0m [[32mINFO[0m] [MessageProcessor] Confidence: LOW (0.31)
[90m[2025-11-08 09:07:21][0m [[32mINFO[0m] [MessageProcessor] Processing completed in 0.41ms
[90m[2025-11-08 09:07:21][0m [[32mINFO[0m] [MessageProcessor] Processing message ID: 3642 from channel: Eric Cryptomans Journal
[90m[2025-11-08 09:07:21][0m [[32mINFO[0m] [MessageProcessor] Engagement metrics: forwards=5, reactions=0, replies=0
[90m[2025-11-08 09:07:21][0m [[32mINFO[0m] [HDRBScorer] HDRB score calculated: IC=5.0, normalized=0.50/100
[90m[2025-11-08 09:07:21][0m [[32mINFO[0m] [SentimentAnalyzer] Sentiment analysis: neutral (score: +0.00)
[90m[2025-11-08 09:07:21][0m [[32mINFO[0m] [MessageProcessor] Confidence: LOW (0.05)
[90m[2025-11-08 09:07:21][0m [[32mINFO[0m] [MessageProcessor] Processing completed in 0.32ms
[90m[2025-11-08 09:07:21][0m [[32mINFO[0m] [MessageProcessor] Processing message ID: 3641 from channel: Eric Cryptomans Journal
[90m[2025-11-08 09:07:21][0m [[32mINFO[0m] [MessageProcessor] Engagement metrics: forwards=31, reactions=0, replies=0
[90m[2025-11-08 09:07:21][0m [[32mINFO[0m] [HDRBScorer] HDRB score calculated: IC=31.0, normalized=3.10/100
[90m[2025-11-08 09:07:21][0m [[32mINFO[0m] [CryptoDetector] Crypto detection found: ['NEAR', '5gb4npgfb3mhfhsekn4sbay6t9mb8ikce9hyikyid4td']
[90m[2025-11-08 09:07:21][0m [[32mINFO[0m] [SentimentAnalyzer] Sentiment analysis: neutral (score: +0.00)
[90m[2025-11-08 09:07:21][0m [[32mINFO[0m] [MessageProcessor] Confidence: LOW (0.41)
[90m[2025-11-08 09:07:21][0m [[32mINFO[0m] [MessageProcessor] Processing completed in 0.46ms
[90m[2025-11-08 09:07:21][0m [[32mINFO[0m] [AddressExtractor] Found 1 addresses: 1 solana
[90m[2025-11-08 09:07:21][0m [[31mERROR[0m] [PriceEngine] All APIs failed for 5gb4npgfb3mhfhsekn4sbay6t9mb8ikce9hyikyid4td on solana
[90m[2025-11-08 09:07:21][0m [[32mINFO[0m] [MessageProcessor] Processing message ID: 3640 from channel: Eric Cryptomans Journal
[90m[2025-11-08 09:07:21][0m [[32mINFO[0m] [MessageProcessor] Engagement metrics: forwards=11, reactions=0, replies=0
[90m[2025-11-08 09:07:21][0m [[32mINFO[0m] [HDRBScorer] HDRB score calculated: IC=11.0, normalized=1.10/100
[90m[2025-11-08 09:07:21][0m [[32mINFO[0m] [CryptoDetector] Crypto detection found: ['0xba123e7cad737b7f8d4580d04e525724c3c80f1a']
[90m[2025-11-08 09:07:21][0m [[32mINFO[0m] [SentimentAnalyzer] Sentiment analysis: positive (score: +1.00)
[90m[2025-11-08 09:07:21][0m [[32mINFO[0m] [MessageProcessor] Confidence: LOW (0.60)
[90m[2025-11-08 09:07:21][0m [[32mINFO[0m] [MessageProcessor] Processing completed in 0.65ms
[90m[2025-11-08 09:07:21][0m [[32mINFO[0m] [AddressExtractor] Found 1 addresses: 1 evm
[90m[2025-11-08 09:07:21][0m [[31mERROR[0m] [PriceEngine] All APIs failed for 0xba123e7cad737b7f8d4580d04e525724c3c80f1a on evm
[90m[2025-11-08 09:07:21][0m [[32mINFO[0m] [MessageProcessor] Processing message ID: 3639 from channel: Eric Cryptomans Journal
[90m[2025-11-08 09:07:21][0m [[32mINFO[0m] [MessageProcessor] Engagement metrics: forwards=7, reactions=0, replies=0
[90m[2025-11-08 09:07:21][0m [[32mINFO[0m] [HDRBScorer] HDRB score calculated: IC=7.0, normalized=0.70/100
[90m[2025-11-08 09:07:21][0m [[32mINFO[0m] [SentimentAnalyzer] Sentiment analysis: neutral (score: +0.00)
[90m[2025-11-08 09:07:21][0m [[32mINFO[0m] [MessageProcessor] Confidence: LOW (0.04)
[90m[2025-11-08 09:07:21][0m [[32mINFO[0m] [MessageProcessor] Processing completed in 0.35ms
[90m[2025-11-08 09:07:21][0m [[32mINFO[0m] [MessageProcessor] Processing message ID: 3638 from channel: Eric Cryptomans Journal
[90m[2025-11-08 09:07:21][0m [[32mINFO[0m] [MessageProcessor] Engagement metrics: forwards=6, reactions=0, replies=0
[90m[2025-11-08 09:07:21][0m [[32mINFO[0m] [HDRBScorer] HDRB score calculated: IC=6.0, normalized=0.60/100
[90m[2025-11-08 09:07:21][0m [[32mINFO[0m] [SentimentAnalyzer] Sentiment analysis: positive (score: +1.00)
[90m[2025-11-08 09:07:21][0m [[32mINFO[0m] [MessageProcessor] Confidence: LOW (0.29)
[90m[2025-11-08 09:07:21][0m [[32mINFO[0m] [MessageProcessor] Processing completed in 0.44ms
[90m[2025-11-08 09:07:21][0m [[32mINFO[0m] [MessageProcessor] Processing message ID: 3636 from channel: Eric Cryptomans Journal
[90m[2025-11-08 09:07:21][0m [[32mINFO[0m] [MessageProcessor] Engagement metrics: forwards=20, reactions=0, replies=0
[90m[2025-11-08 09:07:21][0m [[32mINFO[0m] [HDRBScorer] HDRB score calculated: IC=20.0, normalized=2.00/100
[90m[2025-11-08 09:07:21][0m [[32mINFO[0m] [SentimentAnalyzer] Sentiment analysis: neutral (score: +0.00)
[90m[2025-11-08 09:07:21][0m [[32mINFO[0m] [MessageProcessor] Confidence: LOW (0.06)
[90m[2025-11-08 09:07:21][0m [[32mINFO[0m] [MessageProcessor] Processing completed in 0.33ms
[90m[2025-11-08 09:07:21][0m [[32mINFO[0m] [MessageProcessor] Processing message ID: 3635 from channel: Eric Cryptomans Journal
[90m[2025-11-08 09:07:21][0m [[32mINFO[0m] [MessageProcessor] Engagement metrics: forwards=23, reactions=0, replies=0
[90m[2025-11-08 09:07:21][0m [[32mINFO[0m] [HDRBScorer] HDRB score calculated: IC=23.0, normalized=2.30/100
[90m[2025-11-08 09:07:21][0m [[32mINFO[0m] [SentimentAnalyzer] Sentiment analysis: neutral (score: +0.00)
[90m[2025-11-08 09:07:21][0m [[32mINFO[0m] [MessageProcessor] Confidence: LOW (0.07)
[90m[2025-11-08 09:07:21][0m [[32mINFO[0m] [MessageProcessor] Processing completed in 0.33ms
[90m[2025-11-08 09:07:21][0m [[32mINFO[0m] [HistoricalScraper] Processing message 10/42
[90m[2025-11-08 09:07:21][0m [[32mINFO[0m] [MessageProcessor] Processing message ID: 3634 from channel: Eric Cryptomans Journal
[90m[2025-11-08 09:07:21][0m [[32mINFO[0m] [MessageProcessor] Engagement metrics: forwards=14, reactions=0, replies=0
[90m[2025-11-08 09:07:21][0m [[32mINFO[0m] [HDRBScorer] HDRB score calculated: IC=14.0, normalized=1.40/100
[90m[2025-11-08 09:07:21][0m [[32mINFO[0m] [SentimentAnalyzer] Sentiment analysis: positive (score: +1.00)
[90m[2025-11-08 09:07:21][0m [[32mINFO[0m] [MessageProcessor] Confidence: LOW (0.31)
[90m[2025-11-08 09:07:21][0m [[32mINFO[0m] [MessageProcessor] Processing completed in 0.35ms
[90m[2025-11-08 09:07:21][0m [[32mINFO[0m] [MessageProcessor] Processing message ID: 3633 from channel: Eric Cryptomans Journal
[90m[2025-11-08 09:07:21][0m [[32mINFO[0m] [MessageProcessor] Engagement metrics: forwards=3, reactions=0, replies=0
[90m[2025-11-08 09:07:21][0m [[32mINFO[0m] [HDRBScorer] HDRB score calculated: IC=3.0, normalized=0.30/100
[90m[2025-11-08 09:07:21][0m [[32mINFO[0m] [SentimentAnalyzer] Sentiment analysis: neutral (score: +0.00)
[90m[2025-11-08 09:07:21][0m [[32mINFO[0m] [MessageProcessor] Confidence: LOW (0.03)
[90m[2025-11-08 09:07:21][0m [[32mINFO[0m] [MessageProcessor] Processing completed in 0.29ms
[90m[2025-11-08 09:07:21][0m [[32mINFO[0m] [MessageProcessor] Processing message ID: 3632 from channel: Eric Cryptomans Journal
[90m[2025-11-08 09:07:21][0m [[32mINFO[0m] [MessageProcessor] Engagement metrics: forwards=13, reactions=0, replies=0
[90m[2025-11-08 09:07:21][0m [[32mINFO[0m] [HDRBScorer] HDRB score calculated: IC=13.0, normalized=1.30/100
[90m[2025-11-08 09:07:21][0m [[32mINFO[0m] [SentimentAnalyzer] Sentiment analysis: positive (score: +1.00)
[90m[2025-11-08 09:07:21][0m [[32mINFO[0m] [MessageProcessor] Confidence: LOW (0.22)
[90m[2025-11-08 09:07:21][0m [[32mINFO[0m] [MessageProcessor] Processing completed in 0.28ms
[90m[2025-11-08 09:07:21][0m [[32mINFO[0m] [MessageProcessor] Processing message ID: 3631 from channel: Eric Cryptomans Journal
[90m[2025-11-08 09:07:21][0m [[32mINFO[0m] [MessageProcessor] Engagement metrics: forwards=14, reactions=0, replies=0
[90m[2025-11-08 09:07:21][0m [[32mINFO[0m] [HDRBScorer] HDRB score calculated: IC=14.0, normalized=1.40/100
[90m[2025-11-08 09:07:21][0m [[32mINFO[0m] [SentimentAnalyzer] Sentiment analysis: neutral (score: +0.00)
[90m[2025-11-08 09:07:21][0m [[32mINFO[0m] [MessageProcessor] Confidence: LOW (0.04)
[90m[2025-11-08 09:07:21][0m [[32mINFO[0m] [MessageProcessor] Processing completed in 0.31ms
[90m[2025-11-08 09:07:21][0m [[32mINFO[0m] [MessageProcessor] Processing message ID: 3629 from channel: Eric Cryptomans Journal
[90m[2025-11-08 09:07:21][0m [[32mINFO[0m] [MessageProcessor] Engagement metrics: forwards=25, reactions=0, replies=0
[90m[2025-11-08 09:07:21][0m [[32mINFO[0m] [HDRBScorer] HDRB score calculated: IC=25.0, normalized=2.50/100
[90m[2025-11-08 09:07:21][0m [[32mINFO[0m] [SentimentAnalyzer] Sentiment analysis: neutral (score: +0.00)
[90m[2025-11-08 09:07:21][0m [[32mINFO[0m] [MessageProcessor] Confidence: LOW (0.11)
[90m[2025-11-08 09:07:21][0m [[32mINFO[0m] [MessageProcessor] Processing completed in 0.39ms
[90m[2025-11-08 09:07:21][0m [[32mINFO[0m] [MessageProcessor] Processing message ID: 3628 from channel: Eric Cryptomans Journal
[90m[2025-11-08 09:07:21][0m [[32mINFO[0m] [MessageProcessor] Engagement metrics: forwards=15, reactions=0, replies=0
[90m[2025-11-08 09:07:21][0m [[32mINFO[0m] [HDRBScorer] HDRB score calculated: IC=15.0, normalized=1.50/100
[90m[2025-11-08 09:07:21][0m [[32mINFO[0m] [SentimentAnalyzer] Sentiment analysis: positive (score: +1.00)
[90m[2025-11-08 09:07:21][0m [[32mINFO[0m] [MessageProcessor] Confidence: LOW (0.24)
[90m[2025-11-08 09:07:21][0m [[32mINFO[0m] [MessageProcessor] Processing completed in 0.35ms
[90m[2025-11-08 09:07:21][0m [[32mINFO[0m] [MessageProcessor] Processing message ID: 3627 from channel: Eric Cryptomans Journal
[90m[2025-11-08 09:07:21][0m [[32mINFO[0m] [MessageProcessor] Engagement metrics: forwards=16, reactions=0, replies=0
[90m[2025-11-08 09:07:21][0m [[32mINFO[0m] [HDRBScorer] HDRB score calculated: IC=16.0, normalized=1.60/100
[90m[2025-11-08 09:07:21][0m [[32mINFO[0m] [SentimentAnalyzer] Sentiment analysis: neutral (score: +0.00)
[90m[2025-11-08 09:07:21][0m [[32mINFO[0m] [MessageProcessor] Confidence: LOW (0.04)
[90m[2025-11-08 09:07:21][0m [[32mINFO[0m] [MessageProcessor] Processing completed in 0.30ms
[90m[2025-11-08 09:07:21][0m [[32mINFO[0m] [MessageProcessor] Processing message ID: 3626 from channel: Eric Cryptomans Journal
[90m[2025-11-08 09:07:21][0m [[32mINFO[0m] [MessageProcessor] Engagement metrics: forwards=6, reactions=0, replies=0
[90m[2025-11-08 09:07:21][0m [[32mINFO[0m] [HDRBScorer] HDRB score calculated: IC=6.0, normalized=0.60/100
[90m[2025-11-08 09:07:21][0m [[32mINFO[0m] [SentimentAnalyzer] Sentiment analysis: neutral (score: +0.00)
[90m[2025-11-08 09:07:21][0m [[32mINFO[0m] [MessageProcessor] Confidence: LOW (0.03)
[90m[2025-11-08 09:07:21][0m [[32mINFO[0m] [MessageProcessor] Processing completed in 0.29ms
[90m[2025-11-08 09:07:21][0m [[32mINFO[0m] [MessageProcessor] Processing message ID: 3625 from channel: Eric Cryptomans Journal
[90m[2025-11-08 09:07:21][0m [[32mINFO[0m] [MessageProcessor] Engagement metrics: forwards=14, reactions=0, replies=0
[90m[2025-11-08 09:07:21][0m [[32mINFO[0m] [HDRBScorer] HDRB score calculated: IC=14.0, normalized=1.40/100
[90m[2025-11-08 09:07:21][0m [[32mINFO[0m] [SentimentAnalyzer] Sentiment analysis: neutral (score: +0.00)
[90m[2025-11-08 09:07:21][0m [[32mINFO[0m] [MessageProcessor] Confidence: LOW (0.04)
[90m[2025-11-08 09:07:21][0m [[32mINFO[0m] [MessageProcessor] Processing completed in 0.30ms
[90m[2025-11-08 09:07:21][0m [[32mINFO[0m] [MessageProcessor] Processing message ID: 3624 from channel: Eric Cryptomans Journal
[90m[2025-11-08 09:07:21][0m [[32mINFO[0m] [MessageProcessor] Engagement metrics: forwards=15, reactions=0, replies=0
[90m[2025-11-08 09:07:21][0m [[32mINFO[0m] [HDRBScorer] HDRB score calculated: IC=15.0, normalized=1.50/100
[90m[2025-11-08 09:07:21][0m [[32mINFO[0m] [SentimentAnalyzer] Sentiment analysis: neutral (score: +0.00)
[90m[2025-11-08 09:07:21][0m [[32mINFO[0m] [MessageProcessor] Confidence: LOW (0.04)
[90m[2025-11-08 09:07:21][0m [[32mINFO[0m] [MessageProcessor] Processing completed in 0.32ms
[90m[2025-11-08 09:07:21][0m [[32mINFO[0m] [HistoricalScraper] Processing message 20/42
[90m[2025-11-08 09:07:21][0m [[32mINFO[0m] [MessageProcessor] Processing message ID: 3623 from channel: Eric Cryptomans Journal
[90m[2025-11-08 09:07:21][0m [[32mINFO[0m] [MessageProcessor] Engagement metrics: forwards=11, reactions=0, replies=0
[90m[2025-11-08 09:07:21][0m [[32mINFO[0m] [HDRBScorer] HDRB score calculated: IC=11.0, normalized=1.10/100
[90m[2025-11-08 09:07:21][0m [[32mINFO[0m] [SentimentAnalyzer] Sentiment analysis: neutral (score: +0.00)
[90m[2025-11-08 09:07:21][0m [[32mINFO[0m] [MessageProcessor] Confidence: LOW (0.05)
[90m[2025-11-08 09:07:21][0m [[32mINFO[0m] [MessageProcessor] Processing completed in 0.31ms
[90m[2025-11-08 09:07:21][0m [[32mINFO[0m] [MessageProcessor] Processing message ID: 3622 from channel: Eric Cryptomans Journal
[90m[2025-11-08 09:07:21][0m [[32mINFO[0m] [MessageProcessor] Engagement metrics: forwards=11, reactions=0, replies=0
[90m[2025-11-08 09:07:21][0m [[32mINFO[0m] [HDRBScorer] HDRB score calculated: IC=11.0, normalized=1.10/100
[90m[2025-11-08 09:07:21][0m [[32mINFO[0m] [SentimentAnalyzer] Sentiment analysis: neutral (score: +0.00)
[90m[2025-11-08 09:07:21][0m [[32mINFO[0m] [MessageProcessor] Confidence: LOW (0.01)
[90m[2025-11-08 09:07:21][0m [[32mINFO[0m] [MessageProcessor] Processing completed in 0.34ms
[90m[2025-11-08 09:07:21][0m [[32mINFO[0m] [MessageProcessor] Processing message ID: 3621 from channel: Eric Cryptomans Journal
[90m[2025-11-08 09:07:21][0m [[32mINFO[0m] [MessageProcessor] Engagement metrics: forwards=15, reactions=0, replies=0
[90m[2025-11-08 09:07:21][0m [[32mINFO[0m] [HDRBScorer] HDRB score calculated: IC=15.0, normalized=1.50/100
[90m[2025-11-08 09:07:21][0m [[32mINFO[0m] [SentimentAnalyzer] Sentiment analysis: neutral (score: +0.00)
[90m[2025-11-08 09:07:21][0m [[32mINFO[0m] [MessageProcessor] Confidence: LOW (0.01)
[90m[2025-11-08 09:07:21][0m [[32mINFO[0m] [MessageProcessor] Processing completed in 0.28ms
[90m[2025-11-08 09:07:21][0m [[32mINFO[0m] [MessageProcessor] Processing message ID: 3620 from channel: Eric Cryptomans Journal
[90m[2025-11-08 09:07:21][0m [[32mINFO[0m] [MessageProcessor] Engagement metrics: forwards=9, reactions=0, replies=0
[90m[2025-11-08 09:07:21][0m [[32mINFO[0m] [HDRBScorer] HDRB score calculated: IC=9.0, normalized=0.90/100
[90m[2025-11-08 09:07:21][0m [[32mINFO[0m] [SentimentAnalyzer] Sentiment analysis: neutral (score: +0.00)
[90m[2025-11-08 09:07:21][0m [[32mINFO[0m] [MessageProcessor] Confidence: LOW (0.03)
[90m[2025-11-08 09:07:21][0m [[32mINFO[0m] [MessageProcessor] Processing completed in 0.28ms
[90m[2025-11-08 09:07:21][0m [[32mINFO[0m] [MessageProcessor] Processing message ID: 3619 from channel: Eric Cryptomans Journal
[90m[2025-11-08 09:07:21][0m [[32mINFO[0m] [MessageProcessor] Engagement metrics: forwards=23, reactions=0, replies=0
[90m[2025-11-08 09:07:21][0m [[32mINFO[0m] [HDRBScorer] HDRB score calculated: IC=23.0, normalized=2.30/100
[90m[2025-11-08 09:07:21][0m [[32mINFO[0m] [CryptoDetector] Crypto detection found: ['AVAX']
[90m[2025-11-08 09:07:21][0m [[32mINFO[0m] [SentimentAnalyzer] Sentiment analysis: neutral (score: +0.00)
[90m[2025-11-08 09:07:21][0m [[32mINFO[0m] [MessageProcessor] Confidence: LOW (0.36)
[90m[2025-11-08 09:07:21][0m [[32mINFO[0m] [MessageProcessor] Processing completed in 0.39ms
[90m[2025-11-08 09:07:21][0m [[32mINFO[0m] [MessageProcessor] Processing message ID: 3617 from channel: Eric Cryptomans Journal
[90m[2025-11-08 09:07:21][0m [[32mINFO[0m] [MessageProcessor] Engagement metrics: forwards=39, reactions=0, replies=0
[90m[2025-11-08 09:07:21][0m [[32mINFO[0m] [HDRBScorer] HDRB score calculated: IC=39.0, normalized=3.90/100
[90m[2025-11-08 09:07:21][0m [[32mINFO[0m] [CryptoDetector] Crypto detection found: ['AVAX']
[90m[2025-11-08 09:07:21][0m [[32mINFO[0m] [SentimentAnalyzer] Sentiment analysis: neutral (score: +0.00)
[90m[2025-11-08 09:07:21][0m [[32mINFO[0m] [MessageProcessor] Confidence: LOW (0.42)
[90m[2025-11-08 09:07:21][0m [[32mINFO[0m] [MessageProcessor] Processing completed in 0.42ms
[90m[2025-11-08 09:07:21][0m [[32mINFO[0m] [MessageProcessor] Processing message ID: 3616 from channel: Eric Cryptomans Journal
[90m[2025-11-08 09:07:21][0m [[32mINFO[0m] [MessageProcessor] Engagement metrics: forwards=12, reactions=0, replies=0
[90m[2025-11-08 09:07:21][0m [[32mINFO[0m] [HDRBScorer] HDRB score calculated: IC=12.0, normalized=1.20/100
[90m[2025-11-08 09:07:21][0m [[32mINFO[0m] [SentimentAnalyzer] Sentiment analysis: positive (score: +1.00)
[90m[2025-11-08 09:07:21][0m [[32mINFO[0m] [MessageProcessor] Confidence: LOW (0.30)
[90m[2025-11-08 09:07:21][0m [[32mINFO[0m] [MessageProcessor] Processing completed in 0.41ms
[90m[2025-11-08 09:07:21][0m [[32mINFO[0m] [MessageProcessor] Processing message ID: 3615 from channel: Eric Cryptomans Journal
[90m[2025-11-08 09:07:21][0m [[32mINFO[0m] [MessageProcessor] Engagement metrics: forwards=11, reactions=0, replies=0
[90m[2025-11-08 09:07:21][0m [[32mINFO[0m] [HDRBScorer] HDRB score calculated: IC=11.0, normalized=1.10/100
[90m[2025-11-08 09:07:21][0m [[32mINFO[0m] [SentimentAnalyzer] Sentiment analysis: neutral (score: +0.00)
[90m[2025-11-08 09:07:21][0m [[32mINFO[0m] [MessageProcessor] Confidence: LOW (0.02)
[90m[2025-11-08 09:07:21][0m [[32mINFO[0m] [MessageProcessor] Processing completed in 0.28ms
[90m[2025-11-08 09:07:21][0m [[32mINFO[0m] [MessageProcessor] Processing message ID: 3614 from channel: Eric Cryptomans Journal
[90m[2025-11-08 09:07:21][0m [[32mINFO[0m] [MessageProcessor] Engagement metrics: forwards=16, reactions=0, replies=0
[90m[2025-11-08 09:07:21][0m [[32mINFO[0m] [HDRBScorer] HDRB score calculated: IC=16.0, normalized=1.60/100
[90m[2025-11-08 09:07:21][0m [[32mINFO[0m] [SentimentAnalyzer] Sentiment analysis: neutral (score: +0.00)
[90m[2025-11-08 09:07:21][0m [[32mINFO[0m] [MessageProcessor] Confidence: LOW (0.04)
[90m[2025-11-08 09:07:21][0m [[32mINFO[0m] [MessageProcessor] Processing completed in 0.32ms
[90m[2025-11-08 09:07:21][0m [[32mINFO[0m] [MessageProcessor] Processing message ID: 3613 from channel: Eric Cryptomans Journal
[90m[2025-11-08 09:07:21][0m [[32mINFO[0m] [MessageProcessor] Engagement metrics: forwards=31, reactions=0, replies=0
[90m[2025-11-08 09:07:21][0m [[32mINFO[0m] [HDRBScorer] HDRB score calculated: IC=31.0, normalized=3.10/100
[90m[2025-11-08 09:07:21][0m [[32mINFO[0m] [SentimentAnalyzer] Sentiment analysis: neutral (score: +0.00)
[90m[2025-11-08 09:07:21][0m [[32mINFO[0m] [MessageProcessor] Confidence: LOW (0.09)
[90m[2025-11-08 09:07:21][0m [[32mINFO[0m] [MessageProcessor] Processing completed in 0.32ms
[90m[2025-11-08 09:07:21][0m [[32mINFO[0m] [HistoricalScraper] Processing message 30/42
[90m[2025-11-08 09:07:21][0m [[32mINFO[0m] [MessageProcessor] Processing message ID: 3612 from channel: Eric Cryptomans Journal
[90m[2025-11-08 09:07:21][0m [[32mINFO[0m] [MessageProcessor] Engagement metrics: forwards=24, reactions=0, replies=0
[90m[2025-11-08 09:07:21][0m [[32mINFO[0m] [HDRBScorer] HDRB score calculated: IC=24.0, normalized=2.40/100
[90m[2025-11-08 09:07:21][0m [[32mINFO[0m] [SentimentAnalyzer] Sentiment analysis: positive (score: +1.00)
[90m[2025-11-08 09:07:21][0m [[32mINFO[0m] [MessageProcessor] Confidence: LOW (0.31)
[90m[2025-11-08 09:07:21][0m [[32mINFO[0m] [MessageProcessor] Processing completed in 0.40ms
[90m[2025-11-08 09:07:21][0m [[32mINFO[0m] [MessageProcessor] Processing message ID: 3611 from channel: Eric Cryptomans Journal
[90m[2025-11-08 09:07:21][0m [[32mINFO[0m] [MessageProcessor] Engagement metrics: forwards=17, reactions=0, replies=0
[90m[2025-11-08 09:07:21][0m [[32mINFO[0m] [HDRBScorer] HDRB score calculated: IC=17.0, normalized=1.70/100
[90m[2025-11-08 09:07:21][0m [[32mINFO[0m] [SentimentAnalyzer] Sentiment analysis: positive (score: +1.00)
[90m[2025-11-08 09:07:21][0m [[32mINFO[0m] [MessageProcessor] Confidence: LOW (0.29)
[90m[2025-11-08 09:07:21][0m [[32mINFO[0m] [MessageProcessor] Processing completed in 0.33ms
[90m[2025-11-08 09:07:21][0m [[32mINFO[0m] [MessageProcessor] Processing message ID: 3610 from channel: Eric Cryptomans Journal
[90m[2025-11-08 09:07:21][0m [[32mINFO[0m] [MessageProcessor] Engagement metrics: forwards=41, reactions=0, replies=0
[90m[2025-11-08 09:07:21][0m [[32mINFO[0m] [HDRBScorer] HDRB score calculated: IC=41.0, normalized=4.10/100
[90m[2025-11-08 09:07:21][0m [[32mINFO[0m] [SentimentAnalyzer] Sentiment analysis: neutral (score: +0.00)
[90m[2025-11-08 09:07:21][0m [[32mINFO[0m] [MessageProcessor] Confidence: LOW (0.12)
[90m[2025-11-08 09:07:21][0m [[32mINFO[0m] [MessageProcessor] Processing completed in 0.36ms
[90m[2025-11-08 09:07:21][0m [[32mINFO[0m] [MessageProcessor] Processing message ID: 3609 from channel: Eric Cryptomans Journal
[90m[2025-11-08 09:07:21][0m [[32mINFO[0m] [MessageProcessor] Engagement metrics: forwards=74, reactions=0, replies=0
[90m[2025-11-08 09:07:21][0m [[32mINFO[0m] [HDRBScorer] HDRB score calculated: IC=74.0, normalized=7.40/100
[90m[2025-11-08 09:07:21][0m [[32mINFO[0m] [CryptoDetector] Crypto detection found: ['0x8dedf84656fa932157e27c060d8613824e7979e3']
[90m[2025-11-08 09:07:21][0m [[32mINFO[0m] [SentimentAnalyzer] Sentiment analysis: neutral (score: +0.00)
[90m[2025-11-08 09:07:21][0m [[32mINFO[0m] [MessageProcessor] Confidence: LOW (0.43)
[90m[2025-11-08 09:07:21][0m [[32mINFO[0m] [MessageProcessor] Processing completed in 0.45ms
[90m[2025-11-08 09:07:21][0m [[32mINFO[0m] [AddressExtractor] Found 1 addresses: 1 evm
[90m[2025-11-08 09:07:22][0m [[32mINFO[0m] [PriceEngine] Price fetched from dexscreener: $0.074940
[90m[2025-11-08 09:07:22][0m [[32mINFO[0m] [MessageProcessor] Processing message ID: 3608 from channel: Eric Cryptomans Journal
[90m[2025-11-08 09:07:22][0m [[32mINFO[0m] [MessageProcessor] Engagement metrics: forwards=7, reactions=0, replies=0
[90m[2025-11-08 09:07:22][0m [[32mINFO[0m] [HDRBScorer] HDRB score calculated: IC=7.0, normalized=0.70/100
[90m[2025-11-08 09:07:22][0m [[32mINFO[0m] [SentimentAnalyzer] Sentiment analysis: neutral (score: +0.00)
[90m[2025-11-08 09:07:22][0m [[32mINFO[0m] [MessageProcessor] Confidence: LOW (0.03)
[90m[2025-11-08 09:07:22][0m [[32mINFO[0m] [MessageProcessor] Processing completed in 0.33ms
[90m[2025-11-08 09:07:22][0m [[32mINFO[0m] [MessageProcessor] Processing message ID: 3607 from channel: Eric Cryptomans Journal
[90m[2025-11-08 09:07:22][0m [[32mINFO[0m] [MessageProcessor] Engagement metrics: forwards=26, reactions=0, replies=0
[90m[2025-11-08 09:07:22][0m [[32mINFO[0m] [HDRBScorer] HDRB score calculated: IC=26.0, normalized=2.60/100
[90m[2025-11-08 09:07:22][0m [[32mINFO[0m] [SentimentAnalyzer] Sentiment analysis: neutral (score: +0.00)
[90m[2025-11-08 09:07:22][0m [[32mINFO[0m] [MessageProcessor] Confidence: LOW (0.11)
[90m[2025-11-08 09:07:22][0m [[32mINFO[0m] [MessageProcessor] Processing completed in 0.45ms
[90m[2025-11-08 09:07:22][0m [[32mINFO[0m] [MessageProcessor] Processing message ID: 3606 from channel: Eric Cryptomans Journal
[90m[2025-11-08 09:07:22][0m [[32mINFO[0m] [MessageProcessor] Engagement metrics: forwards=12, reactions=0, replies=0
[90m[2025-11-08 09:07:22][0m [[32mINFO[0m] [HDRBScorer] HDRB score calculated: IC=12.0, normalized=1.20/100
[90m[2025-11-08 09:07:22][0m [[32mINFO[0m] [SentimentAnalyzer] Sentiment analysis: neutral (score: +0.00)
[90m[2025-11-08 09:07:22][0m [[32mINFO[0m] [MessageProcessor] Confidence: LOW (0.05)
[90m[2025-11-08 09:07:22][0m [[32mINFO[0m] [MessageProcessor] Processing completed in 0.33ms
[90m[2025-11-08 09:07:22][0m [[32mINFO[0m] [MessageProcessor] Processing message ID: 3604 from channel: Eric Cryptomans Journal
[90m[2025-11-08 09:07:22][0m [[32mINFO[0m] [MessageProcessor] Engagement metrics: forwards=34, reactions=0, replies=0
[90m[2025-11-08 09:07:22][0m [[32mINFO[0m] [HDRBScorer] HDRB score calculated: IC=34.0, normalized=3.40/100
[90m[2025-11-08 09:07:22][0m [[32mINFO[0m] [SentimentAnalyzer] Sentiment analysis: negative (score: -1.00)
[90m[2025-11-08 09:07:22][0m [[32mINFO[0m] [MessageProcessor] Confidence: LOW (0.31)
[90m[2025-11-08 09:07:22][0m [[32mINFO[0m] [MessageProcessor] Processing completed in 0.38ms
[90m[2025-11-08 09:07:22][0m [[32mINFO[0m] [MessageProcessor] Processing message ID: 3602 from channel: Eric Cryptomans Journal
[90m[2025-11-08 09:07:22][0m [[32mINFO[0m] [MessageProcessor] Engagement metrics: forwards=30, reactions=0, replies=0
[90m[2025-11-08 09:07:22][0m [[32mINFO[0m] [HDRBScorer] HDRB score calculated: IC=30.0, normalized=3.00/100
[90m[2025-11-08 09:07:22][0m [[32mINFO[0m] [CryptoDetector] Crypto detection found: ['ETH', '0xdeba8fd61c1c87b6321a501ebb19e61e610421bf']
[90m[2025-11-08 09:07:22][0m [[32mINFO[0m] [SentimentAnalyzer] Sentiment analysis: neutral (score: +0.00)
[90m[2025-11-08 09:07:22][0m [[32mINFO[0m] [MessageProcessor] Confidence: LOW (0.41)
[90m[2025-11-08 09:07:22][0m [[32mINFO[0m] [MessageProcessor] Processing completed in 0.41ms
[90m[2025-11-08 09:07:22][0m [[32mINFO[0m] [AddressExtractor] Found 1 addresses: 1 evm
[90m[2025-11-08 09:07:22][0m [[31mERROR[0m] [PriceEngine] All APIs failed for 0xdeba8fd61c1c87b6321a501ebb19e61e610421bf on evm
[90m[2025-11-08 09:07:22][0m [[32mINFO[0m] [MessageProcessor] Processing message ID: 3601 from channel: Eric Cryptomans Journal
[90m[2025-11-08 09:07:22][0m [[32mINFO[0m] [MessageProcessor] Engagement metrics: forwards=34, reactions=0, replies=0
[90m[2025-11-08 09:07:22][0m [[32mINFO[0m] [HDRBScorer] HDRB score calculated: IC=34.0, normalized=3.40/100
[90m[2025-11-08 09:07:22][0m [[32mINFO[0m] [SentimentAnalyzer] Sentiment analysis: positive (score: +1.00)
[90m[2025-11-08 09:07:22][0m [[32mINFO[0m] [MessageProcessor] Confidence: LOW (0.26)
[90m[2025-11-08 09:07:22][0m [[32mINFO[0m] [MessageProcessor] Processing completed in 0.35ms
[90m[2025-11-08 09:07:22][0m [[32mINFO[0m] [HistoricalScraper] Processing message 40/42
[90m[2025-11-08 09:07:22][0m [[32mINFO[0m] [MessageProcessor] Processing message ID: 3600 from channel: Eric Cryptomans Journal
[90m[2025-11-08 09:07:22][0m [[32mINFO[0m] [MessageProcessor] Engagement metrics: forwards=14, reactions=0, replies=0
[90m[2025-11-08 09:07:22][0m [[32mINFO[0m] [HDRBScorer] HDRB score calculated: IC=14.0, normalized=1.40/100
[90m[2025-11-08 09:07:22][0m [[32mINFO[0m] [SentimentAnalyzer] Sentiment analysis: neutral (score: +0.00)
[90m[2025-11-08 09:07:22][0m [[32mINFO[0m] [MessageProcessor] Confidence: LOW (0.05)
[90m[2025-11-08 09:07:22][0m [[32mINFO[0m] [MessageProcessor] Processing completed in 0.32ms
[90m[2025-11-08 09:07:22][0m [[32mINFO[0m] [MessageProcessor] Processing message ID: 3599 from channel: Eric Cryptomans Journal
[90m[2025-11-08 09:07:22][0m [[32mINFO[0m] [MessageProcessor] Engagement metrics: forwards=38, reactions=0, replies=0
[90m[2025-11-08 09:07:22][0m [[32mINFO[0m] [HDRBScorer] HDRB score calculated: IC=38.0, normalized=3.80/100
[90m[2025-11-08 09:07:22][0m [[32mINFO[0m] [CryptoDetector] Crypto detection found: ['0xF9Ca3fE094212FfA705742D3626a8Ab96aAbABf8']
[90m[2025-11-08 09:07:22][0m [[32mINFO[0m] [SentimentAnalyzer] Sentiment analysis: neutral (score: +0.00)
[90m[2025-11-08 09:07:22][0m [[32mINFO[0m] [MessageProcessor] Confidence: LOW (0.42)
[90m[2025-11-08 09:07:22][0m [[32mINFO[0m] [MessageProcessor] Processing completed in 0.50ms
[90m[2025-11-08 09:07:22][0m [[32mINFO[0m] [AddressExtractor] Found 1 addresses: 1 evm
[90m[2025-11-08 09:07:22][0m [[32mINFO[0m] [PriceEngine] Price fetched from dexscreener: $0.030370
[90m[2025-11-08 09:07:22][0m [[32mINFO[0m] [MessageProcessor] Processing message ID: 3595 from channel: Eric Cryptomans Journal
[90m[2025-11-08 09:07:22][0m [[32mINFO[0m] [MessageProcessor] Engagement metrics: forwards=23, reactions=0, replies=0
[90m[2025-11-08 09:07:22][0m [[32mINFO[0m] [HDRBScorer] HDRB score calculated: IC=23.0, normalized=2.30/100
[90m[2025-11-08 09:07:22][0m [[32mINFO[0m] [CryptoDetector] Crypto detection found: ['0xdeba8fd61c1c87b6321a501ebb19e61e610421bf']
[90m[2025-11-08 09:07:22][0m [[32mINFO[0m] [SentimentAnalyzer] Sentiment analysis: positive (score: +1.00)
[90m[2025-11-08 09:07:22][0m [[32mINFO[0m] [MessageProcessor] Confidence: LOW (0.61)
[90m[2025-11-08 09:07:22][0m [[32mINFO[0m] [MessageProcessor] Processing completed in 0.50ms
[90m[2025-11-08 09:07:22][0m [[32mINFO[0m] [AddressExtractor] Found 1 addresses: 1 evm
[90m[2025-11-08 09:07:23][0m [[31mERROR[0m] [PriceEngine] All APIs failed for 0xdeba8fd61c1c87b6321a501ebb19e61e610421bf on evm

================================================================================
HISTORICAL SCRAPER VERIFICATION REPORT
================================================================================

Generated: 2025-11-08 09:07:23

================================================================================
SUMMARY STATISTICS
================================================================================
Total messages fetched: 42
Successfully processed: 42
Processing errors: 0
Success rate: 100.0%

================================================================================
HDRB SCORE STATISTICS
================================================================================
Minimum: 0.30/100
Maximum: 7.40/100
Average: 1.95/100

================================================================================
CRYPTO DETECTION STATISTICS
================================================================================
Crypto relevant messages: 8/42
Crypto relevance rate: 19.0%

================================================================================
ADDRESS EXTRACTION STATISTICS (PART 3)
================================================================================
Total addresses found: 6
EVM addresses (Ethereum, BSC, Polygon, etc.): 5
Solana addresses: 1
Invalid addresses: 0
Validation rate: 100.0%

================================================================================
PRICE FETCHING STATISTICS (PART 3)
================================================================================
Valid addresses: 6
Prices fetched: 2
Price failures: 4
Price fetch success rate: 33.3%

API Usage Breakdown:
  dexscreener: 2 requests (100.0%)

================================================================================
SENTIMENT ANALYSIS STATISTICS
================================================================================
Positive: 11
Negative: 1
Neutral: 30

================================================================================
CONFIDENCE STATISTICS
================================================================================
High confidence messages: 0/42
High confidence rate: 0.0%
Average confidence: 0.18

================================================================================
PERFORMANCE STATISTICS
================================================================================
Average processing time: 0.37ms
Minimum processing time: 0.28ms
Maximum processing time: 0.65ms
? Performance target met (< 100ms)

================================================================================
VERIFICATION STATUS
================================================================================
? Messages processed successfully
? HDRB scores calculated
? Crypto detection working
? Sentiment analysis working
? Confidence scores calculated
? Performance targets met

Verification: 6/6 checks passed

? ALL VERIFICATION CHECKS PASSED!

================================================================================
[90m[2025-11-08 09:07:23][0m [[32mINFO[0m] [HistoricalScraper] Report saved to scripts\verification_report.md
[90m[2025-11-08 09:07:23][0m [[32mINFO[0m] [HistoricalScraper] Disconnecting from Telegram...
[90m[2025-11-08 09:07:23][0m [[32mINFO[0m] [TelegramMonitor] Disconnecting from Telegram...
[90m[2025-11-08 09:07:23][0m [[32mINFO[0m] [TelegramMonitor] Disconnected successfully
[90m[2025-11-08 09:07:23][0m [[32mINFO[0m] [PriceEngine] Closing API client sessions...
